{"schema_version":1,"job_id":"b2c3d4e5-f6a7-4b8c-9d0e-f1a2b3c4d5e6","workstream_identity":"test","instruction":"Step 2","dispatch_posture":{"provider":"opencode","model":"opencode-go/mimo-v2.5","mode":"default","thinking":"none"},"follows":"a1b2c3d4-e5f6-4a7b-8c9d-e0f1a2b3c4d5","actor":"operator-confirmed","recorded_at":"2026-08-21T00:00:00Z","confirmation_ref":"def","created_at":"2026-08-21T00:00:00Z"}